Agricultura,¡Vivan los pesticidadas!,Faustino el agricultor,Los agricultores creemos que se necesita mas financiacion para el uso de pesticidas ¿que opinas?,Evento fijo,50,,10,5,-10,-5,-5,,,-5,-5,,,10,,Los pesticidas tienen consecuencias terribles en filtraciones de agua y en la salud de la gente
Agricultura,Necesidad de agua,Faustino el agricultor,Si seguimos asi la cosecha morira necesitamos usar las aguas del acuifero,Evento fijo,50,,20,-5,-15,-15,-20,,,-5,10,,,,ficha sequia,La desviación de acuiferos puede provocar una sequia en la zona
Agricultura,Riego por goteo,Paqui Jefa de Medio Ambiente,Queremos poner riego por goteo para aprovechar todo el agua que tengamos aunque es muy costoso,ficha sequia,,,-15,5,10,,,,,,,-10,,,,Es un tipo de regadio que aprovecha todo el agua posible
Agricultura,Nuevas tierras,Faustino el agricultor,Nuestras tierras anteriores tienen demasiada toxicidad para plantar cultivos por culpa los pesticidas necesitamos nuevos terrenos,ficha pesticidas,,Venga vale,-15,,-5,,-5,,Jamas,,-10,,,,,El uso excesivo de pesticidas puede provocar intoxicaciones no solo de los humanos sino tambien de los suelos
Agricultura y Ganaderia,Plaga de conejos,Eli agente forestal,Hay demasiados conejos van a arrasar con nuestros cultivos ¿que hacemos?,,,Acabad con los conejos,,,,-25,,,No exagereis solo son animales,,,-25,,,,Las plagas de animales pueden ser limitadas o destruiran todo a su paso
Deforestacion,Limpieza de montes,Eli agente forestal,Hay que limpiar los montes para ayudar en los posibles incendios,Evento fijo,50,,-10,10,,,5,,,,,-5,,,,A veces es necasario deforestar para que no aumenten los incendios.Los arboles son necesarios para la fauna y la limpieza del aire
Deforestacion,No al maltrato de los bosques,Toni el activista,No a la destrucción de los bosques dejen de robar las piñas y los elementos de la naturaleza,Evento fijo,50,,15,,-5,,,,,,-10,,,,,A veces aunque se piense que no hacer nada es lo mejor la  mano humana puede ayudar mucho
Deforestacion,Cambio climático,Rodrigo el Biologo,El cambio climático viene haciendo estragos habría que plantar árboles resistentes a los climas nuevos,,,,-15,,15,,,,,,,-10,,,,El cambio climatico viene haciendo estragos y en ciertos lugares los arboles no duraran y sera necesario reforestar con  nuevas especies resistentes a los climas
Energia eolica,Viva el aire ,Paqui Jefa de Medio Ambiente,Creo que podria ser interesante instalar algunas turbinas eolicas para la generación de energia de la zona,Evento fijo,50,,15,5,-5,-10,,ficha eolica,,,-10,5,5,,,Fuente limpia de energia pero ¿es lo suficiente con los gastos que supone y la cantidad de aves que mueren?
Energia eolica,Molinillos,Rodrigo el Biologo,La gente quiere que se instalen molinos de viento. No creo que sea buena para la conservacion de las especies,Evento fijo,50,Tienes razon pasamos de los molinos,,-10,5,5,,,Vamos a probar,15,5,-5,-10,,ficha eolica,Fuente limpia de energia pero ¿es lo suficiente con los gastos que supone y la cantidad de aves que mueren?
Energia eolica,Cambio de parque nacional a parque de molinos,Baltasar el empresario,Parece que la energia eolica provoca beneficios altos quiero llenar el parque nacional de molinos,ficha eolica,,,10,10,-10,-10,,,,-5,-5,,,,,
Fabrica/Economia,Una construccion de fabricas 1,Baltasar el empresario,Te propongo construir una frabrica de Popa-Pola ¡la bebida mas refrescante!,Evento fijo,50,,15,5,-5,-5,10,ficha empresa,,-10,-5,,,,,
Fabrica/Economia,Una construccion de fabricas 2,Toni el activista,No finacies a la fabrica de Baltasar el rio del pueblo se puede ver afectadoooo!,Evento fijo,50,Venga va,-10,-5,,,,,No tiene importancia,15,5,-5,-5,,,
,La poblacion crece,Laura la arquitecto,¡No nos cabe la gente en el pueblo! Deberiamos permitir la expansion del pueblo a areas naturales para acomodar el crecimiento de la poblacion.,ficha empresa,,,-10,20,-10,-5,-5,,,,-30,,,,,
Ganaderia,Ganaderia 1,Faustino el ganadero,La ganaderia puede desempeñar un papel crucial en el desarrollo rural puede  proporcionar grandes oportunidades economicas.Financia mi negocio Cerdos Rurales y te invito a un jamon mozo.,Evento fijo,33.33,A financiar,10,5,-10,-10,-5,,No finacies,-5,-5,5,5,5,,La ganaderia desempeña un papel significativo en la generación de empleo y el desarrollo economico en areas rurales contribuyendo al sustento de comunidades. La produccion de subproductos como el cuero tambien añade valor economico a la industria ganadera. La deforestacion para la ganaderia conlleva la perdida de biodiversidad y desequilibrios ambientales incluyendo la liberacion de carbono que contribuye al cambio climatico. Ademas provoca problemas como la erosion del suelo escasez de agua y conflictos sociales impactando negativamente a comunidades locales y a la salud de los ecosistemas acuaticos por contaminacion.
Ganaderia,Ganaderia 2,Toni el activista,Invertir en la empresa de Faustino es respaldar la destrucción de habitats naturales es financiar la deforestacion para abrir paso a pastizales ganaderos condenando a especies vegetales y animales a la perdida irreversible de su hogar.,Evento fijo,33.33,No finacies,-5,-5,5,5,5,,No finacies,10,5,-10,-10,-5,,La ganaderia desempeña un papel significativo en la generación de empleo y el desarrollo economico en areas rurales contribuyendo al sustento de comunidades. La produccion de subproductos como el cuero tambien añade valor economico a la industria ganadera. La deforestacion para la ganaderia conlleva la perdida de biodiversidad y desequilibrios ambientales incluyendo la liberacion de carbono que contribuye al cambio climatico. Ademas provoca problemas como la erosion del suelo escasez de agua y conflictos sociales impactando negativamente a comunidades locales y a la salud de los ecosistemas acuaticos por contaminacion.
Ganaderia,Ganaderia 3,Rodrigo el Biologo,La ganaderia es reconocida como una de las principales fuentes de emisiones de gases de efecto invernadero. No financies mas este tipo de empresas,Evento fijo,33.33,No finacies,-5,-5,5,5,5,,A financiar,10,5,-10,-10,-5,,La ganaderia desempeña un papel significativo en la generación de empleo y el desarrollo economico en areas rurales contribuyendo al sustento de comunidades. La produccion de subproductos como el cuero tambien añade valor economico a la industria ganadera. La deforestacion para la ganaderia conlleva la perdida de biodiversidad y desequilibrios ambientales incluyendo la liberacion de carbono que contribuye al cambio climatico. Además provoca problemas como la erosion del suelo escasez de agua y conflictos sociales impactando negativamente a comunidades locales y a la salud de los ecosistemas acuaticos por contaminacion.
Energia Solar,Paneles solares 1,Laura la arquitecto,Deberiamos de poner paneles solares en las casas para usar algo de energia renovable,Evento fijo,,,-20,15,5,5,5,,,5,-10,-5,-5,-5,,
Energia Solar,Paneles solares 2,Baltasar el empresario,A la gente no le gusta esa idea de Laura de poner paneles solares dicen que quedan muy feos,Evento fijo,,No quedan tan feos vamos a ponerlos,-20,-15,5,5,5,,No lo haremos entonces,,30,-5,-5,-5,,
Turismo,De fiesta,Baltasar el empresario,Quiero organizar un festival de musica traera turismo y dara popularidad a tu pueblo,,,,10,5,-5,-5,-5,,,-10,-5,5,5,5,,
Caza,Cazado,Faustino el cazador,¿Deberiamos permitir la caza de trofeos para atraer a turistas y generar ingresos para la conservación de la fauna?,,,,5,,,-10,,,,-5,,,10,,,La caza de trofeos genera ingresos trae turistas dispuestos a pagar y puede contribuir al manejo poblacional al seleccionar individuos mayores o especificos. Pero puede tener consecuencias negativas en las poblaciones de especies y es inmoral para muchas personas.
Agricultura,Súper Cosechas,Rodrigo el Biologo,Propongo modificar geneticamente nuestros cultivos para aumentar la produccion y garantizar la seguridad alimentaria. ¿Que opinas?,,,,10,5,,,,,,-10,-5,,,,,Proponer la modificación genética de cultivos para aumentar la producción y garantizar la seguridad alimentaria ofrece beneficios como mayor productividad resistencia a plagas y adaptación a condiciones adversas. Sin embargo plantea inquietudes ambientales por posibles efectos en los ecosistemas y la biodiversidad. Las preocupaciones sobre riesgos para la salud humana vinculados a alimentos modificados genéticamente también son relevantes. Además la dependencia de grandes empresas en este campo podría limitar la diversidad genética de los cultivos y aumentar la vulnerabilidad de los agricultores.
Educacion,A educar,Paqui Jefa de Medio Ambiente,Integrar programas educativos sobre el medio ambiente en las escuelas locales para concienciar a la poblacion sobre la importancia de la conservacion.,,,,-10,,5,5,5,,,5,,-5,-5,-5,,
Ganaderia,Malditos lobitos,Faustino el ganadero,Hay que matar a los lobos se comen el ganado,,,Acabad con ellos,-10,10,,-15,,,Pobres animales,,-20,,,,,
Prevencion de incendios,Epoca de incendios 1,Paqui Jefa de Medio Ambiente,Hacer cortafuegos,Evento fijo,,Ponte con ello,-15,5,,,,ficha cortafuegos,No le veo la utilidad,,-10,,,,no ficha cortafuegos,Los cortafuegos frenan el avance de los incendios y su expansion
Prevencion de incendios,Epoca de incendios 2,Paqui Jefa de Medio Ambiente,Deberiamos ampliar el operativo de prevencion de incendios podriamos construir una torre de vigilancia,Evento fijo,,,-20,20,,,,,,10,-10,-10,,,,
Prevencion de incendios,Epoca de incendios 3,Baltasar el empresario,Gastamos mucho dinero en el operativo de lucha contra incendios y apenas hacen nada deberíamos despedir a las cuadrillas de la zona,Evento fijo,,Despidelos,10,-15,-5,,,,,-15,5,5,,,,
,Incendio,Paqui Jefa de Medio Ambiente,¡Fuego! ¡Fuego! Hay un incendio descontrolado nos va a costar mucho apagarlo...,no ficha cortafuegos,,...,-20,-20,-20,-20,-20,,...,-20,-20,-20,-20,-20,,Los cortafuegos ayudan a controlar los incendios activos y que no se descontrolen.
,Incendio con cortafuegos,Paqui Jefa de Medio Ambiente,Vale tenemos un problema hay un incendio en activo. Lo bueno es que los cortafuegos están ayudando a controlarlo.,ficha cortafuegos,,Esperemos que no sea nada...,-5,-5,-5,-5,-5,,Bueno dentro de lo malo...,-5,-5,-5,-5,-5,,
,Ola de calor,Rodrigo el Biologo,¡Estan a punto de subir 20 grados las temperaturas!,< 25 flora,,...,,-5,-5,-5,-10,,...,,-5,-5,-5,-10,,Los arboles reducen la temperatura en las ciudades hasta 12 ºC
,Accidente por desprendimiento,Laura la arquitecto,¡Es terrible! Ha habido un desprendimiento y ha aplastado un coche. Todos estan bien pero esto no le va a gustar nada a la gente...,ficha desprendimiento,,...,-10,-25,,,,,...,-10,-25,,,,,
,Sequía,Eli agente forestal,La sequia del rio preocupa a la comunidad deberiamos destinar algunos recursos a combatirla.,< 25 aire,,,-25,5,10,5,10,,Seguro que no es para tanto,,-5,-20,-10,-20,,La sequia tiene un impacto brutal en la biodiversidad la calidad del aire y la agricultura
,Desprendimientos,Laura la arquitecto,Ha estado lloviendo mucho ultimamente y hay riesgo de desprendimientos cerca de la carretera.,,,Pondremos mallas de contencion,-5,5,5,5,,,No pasara nada,,-20,-10,-10,,ficha desprendimiento,
,Fiesta en el bosque,Baltasar el empresario,Los jovenes quieren celebrar las fiestas patronales en el bosque. Es un idea horrible pero tu veras,,,En el bosque,,25,-15,-10,-15,,En el pueblo,-10,-20,10,10,10,,
,Energias,Laura la arquitecto,Podemos construir una planta de energia solar o podemos construir una planta de energía tradicional que es mas barata y eficiente.,,,Solar,10,,-10,-5,5,,Tradicional,20,5,-10,-10,-15,,
,Campaña de reciclaje,Toni el activista,¿Que tal si hacemos una campaña para fomentar el reciclaje en el pueblo?,,,,-5,10,10,5,5,,,,-5,-10,-10,-10,,
,Expansion del pueblo,Toni el activista,La expansion del pueblo no es nada buena para la temperatura del ecosistema. Te sugiero que nos la replanteemos.,,,Adelante,,-20,15,10,5,,,20,10,-10,-10,-5,,
",Turismo en masa,Baltasar el empresario,""El turismo en masa puede traernos varios beneficios economicos, piensalo."",,,Bien,20,15,-10,-10,-15,,No lo creo,,-10,,,,,"
",Especies protegidas,Rodrigo el Biologo,""Hay ciertas especies protegidas de aves en los alrededores, podemos echarlas un ojo para que la poblacion se mantenga, pero sera caro."",,,Te encargas,-10,,,15,,,,,,,-20,,,"
",Carreteras,Laura la arquitecto,""Nos han propuesto construir carreteras alrededor del pueblo, es nuestra oportunidad de traer dinero y turismo."",,,,10,10,-20,-20,-5,,Ni de broma,-5,,,,,,"
,Carrera ciclista,Paqui Jefa de Medio Ambiente,Organicemos una carrera ciclista por los alrededores. ¡Seguro que a todo el mundo le encanta!,,,Trae mi bici,-5,20,-5,-5,10,,,,-5,,,,,
,Prohibir el turismo,Rodrigo el Biologo,Hay que prohibir el turismo en ciertas zonas mas frágiles... Como siga asi la cosa nos vamos a quedar sin ecosistema.,,,,-10,-5,5,5,5,,,5,5,-15,-5,-5,,
",Cultivos organicos,Faustino el agricultor,""Ultimamente se lleva mucho eso de lo cultivos organicos, podriamos probar."",,,,-5,,10,,10,,,,5,,,-5,,"
,Central nuclear,Baltasar el empresario,Si andas mal de pasta siempre podemos poner una central nuclear. ¿Te interesa?,< 10 dinero,,,40,-5,-20,-5,-15,,,,5,,,,,
,Espacio verdes,Laura la arquitecto,Nunca sobran espacios verdes en un pueblo. ¿Ponemos unos pocos?,,,,-5,5,5,,5,,Estamos rodeados de verde,,-10,,,-5,,
,Pescadores descontrolados,Eli agente forestal,Se nos esta llendo de las manos lo de los pescadores. Hay que ponerles limites.,,,,-5,-5,10,,5,,,5,5,-15,,-10,,
,Interes por la caza,Faustino el cazador,Hay mucha gente interesada en la caza por aqui. ¿Por que no nos dejas de vez en cuando?,,,Sed responsables,10,5,,-20,,,Ni hablar,,-10,,5,,,
,Subvencion,Paqui Jefa de Medio Ambiente,Nos han subencionado para reforestar la zona.,,,Mola,,,20,5,10,,Nos quedamos el dinero,20,-20,-10,,,,
,Mucho trafico,Toni el activista,Hay mucho trafico ultimamente. Podemos dar algo de dinero para que pasen mas autobuses por el pueblo.,,,Podemos probar,-10,10,,,5,,,,-5,,,-5,,
,Explotar la pesca,Baltasar el empresario,Podemos explotar la pesca para exportar mas productos locales.,,,,10,5,,-10,-5,,,,-5,,,5,,
,viva el aire ,Laura la arquitecto,Si construimos una presa podremos construir un generador hidroelectrico,,,,-20,10,5,-10,-5,,,,-5,,5,5,,
,Granja de credos,Faustino el agricultor,¿Puedo construir una granja de cerdos?,,,,10,5,-5,,-15,,,,-5,,,5,,Las granjas de animales contaminan el agua
,Ataque de lobos,Eli agente forestal,Creo que los ganaderos se han inventado un ataque de lobos. ¿Les creemos?,,,Les creemos,-10,,,-10,,,Se lo han inventado,5,-5,,5,,,A veces los ganaderos se inventan ataques para recibir dinero
,Solo hay pinos,Eli agente forestal,La gente se niega a plantar arboles distintos de pinos. ¿Les obligamos?,,,,-5,-5,15,,10,,Lo que diga el pueblo,5,5,-15,,,,Hay muchos pinos de forma tradicional y ahora se llevan los bosques biodiversos.
,Greenwashing,Toni el activista,La gente de Popa-Pola quiere plantar arboles para reducir su impacto.,ficha empresa,,Perfecto,10,,-10,,-10,,No me fio. Echales un ojo,-5,-5,10,,10,,EL greenwashing consiste en que una empresa contamina mucho y para compensar eso plantan árboles equivalentes a lo que han contaminado. Pero no lo hacen de forma óptima.
,Plantar en verano,Faustino el agricultor,Podemos plantar en verano para ahorrar algo de tiempo.,,,,-5,,-10,,,,No es buena idea,,,10,,,,Si plantamos en verano se nos muere todo.
